title,authors,year,citations,abstract,result_id,publication_info,pdf_links,url,total_results,search_time
GRETNA: a graph theoretical network analysis toolbox for imaging connectomics,"J Wang, X Wang, M Xia, X Liao, A Evans…",2015,1782,"… will facilitate graph-based brain network studies, particularly those based on R-fMRI data. Currently, the Gretna has been successfully applied to many previous connectome studies (He …",4OyoqL7rN5EJ,"J Wang, X Wang, M Xia, X Liao, A Evans… - … in human neuroscience, 2015 - frontiersin.org",[],https://www.frontiersin.org/journals/human-neuroscience/articles/10.3389/fnhum.2015.00386/full,unknown,unknown
Network neuroscience,"DS Bassett, O Sporns",2017,3415,"… network neuroscience and attempt to chart a path toward a better understanding of the brain … of structural connections among neurons and brain areas (connectomics), the physiological …",rk-3AYb1i4UJ,"DS Bassett, O Sporns - Nature neuroscience, 2017 - nature.com",[],https://www.nature.com/articles/nn.4502,unknown,unknown
Brain graphs: graphical models of the human brain connectome,"ET Bullmore, DS Bassett",2011,1507,"… brain graphs is the focus of this article, although we also briefly describe the construction of directed and/or weighted brain graphs… a graph model for the human functional connectome …",tPE0vbEoYfoJ,"ET Bullmore, DS Bassett - Annual review of clinical psychology, 2011 - annualreviews.org",[],https://www.annualreviews.org/content/journals/10.1146/annurev-clinpsy-040510-143934,unknown,unknown
Graph theory methods: applications in brain networks,O Sporns,2018,895,"… Network neuroscience is a thriving and rapidly expanding field. Empirical data on brain networks, … connectivity have given rise to the emerging field of connectomics, Citation12,Citation…",2eMSFIcH5hwJ,"O Sporns - Dialogues in clinical neuroscience, 2018 - Taylor & Francis",[],https://www.tandfonline.com/doi/abs/10.31887/DCNS.2018.20.2/osporns,unknown,unknown
Graph neural networks in network neuroscience,"A Bessadok, MA Mahjoub…",2022,458,"… While it presents an attractive opportunity for network neuroscience, only a few GNN architectures have so far been applied to the brain connectome and the most used GNN model is …",rdenQRHXJ0AJ,"A Bessadok, MA Mahjoub… - IEEE Transactions on …, 2022 - ieeexplore.ieee.org",[],https://ieeexplore.ieee.org/abstract/document/9903566/,unknown,unknown
Application of graph theory for identifying connectivity patterns in human brain networks: a systematic review,"FV Farahani, W Karwowski, NR Lighthall",2019,926,… graph theory and its implications in cognitive neuroscience have attracted the attention of researchers since 2009 (as the Human Connectome … graph theory and network neuroscience (…,EKP42KI55Z8J,"FV Farahani, W Karwowski, NR Lighthall - frontiers in Neuroscience, 2019 - frontiersin.org",[],https://www.frontiersin.org/journals/neuroscience/articles/10.3389/fnins.2019.00585/full,unknown,unknown
Interpretable graph neural networks for connectome-based brain disorder analysis,"H Cui, W Dai, Y Zhu, X Li, L He, C Yang",2022,161,… Brain networks (aka the connectome) are complex graphs … Interpretable models on brain networks for disorder analysis … disorders and neuroscience research [27]. Previous work on …,v7k5X4S8vksJ,"H Cui, W Dai, Y Zhu, X Li, L He, C Yang - International conference on …, 2022 - Springer",[],https://link.springer.com/chapter/10.1007/978-3-031-16452-1_36,unknown,unknown
Neurograph: Benchmarks for graph machine learning in brain connectomics,"A Said, R Bayrak, T Derr, M Shabbir…",2023,71,"… Within the dynamic context, we define a sequence of brain graphs over T timepoints, denoted as G = {G1,G2,...GT }, wherein each graph Gt captured at index t to t + Γ from the fMRI scan. …",Tk6kablmQfcJ,"A Said, R Bayrak, T Derr, M Shabbir… - Advances in …, 2023 - proceedings.neurips.cc",[],https://proceedings.neurips.cc/paper_files/paper/2023/hash/14f656f21d09a4114666f60a45aab1aa-Abstract-Datasets_and_Benchmarks.html,unknown,unknown
BrainNet Viewer: a network visualization tool for human brain connectomics,"M Xia, J Wang, Y He",2013,4835,"… Considering that most of the graph-based brain network analysis toolboxes were developed in a Matlab environment, our toolbox exhibits better compatibility and usability, such as …",Zd1HsM3R8scJ,"M Xia, J Wang, Y He - PloS one, 2013 - journals.plos.org",[],https://journals.plos.org/plosone/article?id=10.1371/journal.pone.0068910,unknown,unknown
Network classification with applications to brain connectomics,"JDA Relión, D Kessler, E Levina…",2019,105,… We propose a graph classification method that uses edge weights as predictors but incorporates the network nature of the data via penalties that promote sparsity in the number of nodes…,J-lgWqy-8SUJ,"JDA Relión, D Kessler, E Levina… - The annals of applied …, 2019 - pmc.ncbi.nlm.nih.gov",[],https://pmc.ncbi.nlm.nih.gov/articles/PMC7785130/,unknown,unknown
Cerebral cartography and connectomics,O Sporns,2015,90,"… Connectomics aims to chart network maps of the brain's structural and functional connections, across scales, from cells to systems, and these maps have begun to reveal principles of …",iN_yMMmaM3MJ,"O Sporns - Philosophical Transactions of the Royal Society B …, 2015 - pmc.ncbi.nlm.nih.gov",[],https://pmc.ncbi.nlm.nih.gov/articles/PMC4387514/,unknown,unknown
From brain topography to brain topology: relevance of graph theory to functional neuroscience,"L Minati, G Varotto, L D'Incerti, F Panzica, D Chan",2013,57,… of graph-based analyses of brain connectivity and their relevance to disease aimed principally at general neuroscientists … field of connectomics and furthering our understanding of brain …,0griGPVkyP0J,"L Minati, G Varotto, L D'Incerti, F Panzica, D Chan - Neuroreport, 2013 - journals.lww.com",[],https://journals.lww.com/neuroreport/fulltext/2013/07100/Article.7.aspx,unknown,unknown
Connectomics and graph theory analyses: Novel insights into network abnormalities in epilepsy,"E Gleichgerrcht, M Kocher, L Bonilha",2015,166,"… aspects of abnormal networks to epilepsy. In … connectomics research regarding neural network architecture, dynamics, and function related to epilepsy. We discuss how connectomics …",7djjuJAHXhwJ,"E Gleichgerrcht, M Kocher, L Bonilha - Epilepsia, 2015 - Wiley Online Library",[],https://onlinelibrary.wiley.com/doi/abs/10.1111/epi.13133,unknown,unknown
Statistical power in network neuroscience,"K Helwegen, I Libedinsky…",2023,79,"… From left to right, the figure illustrates the progression from investigating isolated brain areas (grey areas), to individual tracts (blue lines), to whole-brain connectomics (graph with nodes …",zqdqwU6PLt8J,"K Helwegen, I Libedinsky… - Trends in Cognitive …, 2023 - cell.com",[],https://www.cell.com/trends/cognitive-sciences/abstract/S1364-6613(22)00328-X,unknown,unknown
Connectome-based individual prediction of cognitive behaviors via graph propagation network reveals directed brain network topology,"D Wu, X Li, J Feng",2021,25,… that graph neural network (GNN) which combines graph theory and neural network can be … graph propagation network (GPN) that parameterizes on the information propagation within …,hNQPfuD5fgcJ,"D Wu, X Li, J Feng - Journal of Neural Engineering, 2021 - iopscience.iop.org",[],https://iopscience.iop.org/article/10.1088/1741-2552/ac0f4d/meta,unknown,unknown
A hands-on tutorial on network and topological neuroscience,"EGZ Centeno, G Moreni, C Vriend, L Douw…",2022,62,"… facilitate the use of network neuroscience and its constituents graph theory and TDA … Graph theory Here, we will cover the most commonly used graph metrics in network neuroscience …",CuadqUFhI3QJ,"EGZ Centeno, G Moreni, C Vriend, L Douw… - Brain Structure and …, 2022 - Springer",[],https://link.springer.com/article/10.1007/s00429-021-02435-0,unknown,unknown
Connectome: Graph theory application in functional brain network architecture,"F Vecchio, F Miraglia, PM Rossini",2017,249,"… Network science and graph theory … neuronal network structure, thus providing a conceptual frame that can help in reducing the analytical brain complexity and underlining how network …",dtv1LCcyGLcJ,"F Vecchio, F Miraglia, PM Rossini - Clinical neurophysiology practice, 2017 - Elsevier",[],https://www.sciencedirect.com/science/article/pii/S2467981X17300276,unknown,unknown
"Network science and the human brain: using graph theory to understand the brain and one of its hubs, the amygdala, in health and disease","D Mears, HB Pollard",2016,168,"… Thus, the intrinsic amygdala connectome is set up for segregated functional processing … The work demonstrates the utility of graph theoretical approaches to brain networks because …",QHnXOgB3C6IJ,"D Mears, HB Pollard - Journal of neuroscience research, 2016 - Wiley Online Library",[],https://onlinelibrary.wiley.com/doi/abs/10.1002/jnr.23705,unknown,unknown
Graph analysis of functional brain networks: practical issues in translational neuroscience,"FDV Fallani, J Richiardi, M Chavez…",2014,572,"… inherent topological properties of the networks and yield little power … graph theoretical approaches to analyse brain connectivity, our understanding of brain organization at the network …",vy3CmIJfkxQJ,"FDV Fallani, J Richiardi, M Chavez… - … Transactions of the …, 2014 - pmc.ncbi.nlm.nih.gov",[],https://pmc.ncbi.nlm.nih.gov/articles/PMC4150298/,unknown,unknown
From simple graphs to the connectome: networks in neuroimaging,O Sporns,2012,213,… The importance of brain connectivity naturally leads to the adoption of the theoretical framework of networks and graphs. Network science approaches have been productively deployed …,hRU1j30KXY0J,"O Sporns - Neuroimage, 2012 - Elsevier",[],https://www.sciencedirect.com/science/article/pii/S1053811911010172,unknown,unknown
Graph theoretic analysis of brain connectomics in multiple sclerosis: reliability and relationship with cognition,"T Welton, CS Constantinescu, DP Auer…",2020,46,… of network integrity in MS are relevant for cognitive performance and reliable over time. We hypothesized that graph theoretic brain network … that graph theoretic brain network metrics …,m46MS3IO0ngJ,"T Welton, CS Constantinescu, DP Auer… - Brain …, 2020 - journals.sagepub.com",[],https://journals.sagepub.com/doi/abs/10.1089/brain.2019.0717,unknown,unknown
The connectomics of brain disorders,"A Fornito, A Zalesky, M Breakspear",2015,2131,"… Network science and graph theory offer powerful tools for overcoming these challenges to map, track and predict patterns of disease spread (Box 1; Fig. 1). The application of these …",IRbkyS18gEEJ,"A Fornito, A Zalesky, M Breakspear - Nature reviews neuroscience, 2015 - nature.com",[],https://www.nature.com/articles/nrn3901,unknown,unknown
The importance of the whole: topological data analysis for the network neuroscientist,"AE Sizemore, JE Phillips-Cremins, R Ghrist…",2019,279,"… on the mouse structural connectome, synapses in C. … network science, we might commonly translate our data into a binary graph and then proceed with techniques anchored in graph …",GkLQRC1cgo4J,"AE Sizemore, JE Phillips-Cremins, R Ghrist… - … Neuroscience, 2019 - direct.mit.edu",[],https://direct.mit.edu/netn/article-abstract/3/3/656/2178,unknown,unknown
Neuroscience needs network science,"DL Barabási, G Bianconi, E Bullmore…",2023,137,"… emerging frontiers for network neuroscience in the brain atlas era, … necessitated the use of graph theoretical tools, recent data … , and drug networks and their impact on the connectome. …",tqzIgGdIzssJ,"DL Barabási, G Bianconi, E Bullmore… - … of Neuroscience, 2023 - jneurosci.org",[],https://www.jneurosci.org/content/43/34/5989.abstract,unknown,unknown
"Graph neural networks in brain connectivity studies: Methods, challenges, and future directions","H Mohammadi, W Karwowski",2024,93,… Interpretable graph neural networks for connectome-based brain disorder analysis. In … Joint embedding of structural and functional brain networks with graph neural networks for mental …,m6Aq6uewcr0J,"H Mohammadi, W Karwowski - Brain Sciences, 2024 - mdpi.com",[],https://www.mdpi.com/2076-3425/15/1/17,unknown,unknown
The human connectome: a complex network,O Sporns,2011,1783,"… network concepts and network thinking to the human brain. I will survey the contributions of network science to our understanding of how human brain … Throughout, I will attempt to chart …",G9cAvraPahMJ,"O Sporns - Annals of the new York Academy of Sciences, 2011 - Wiley Online Library",[],https://nyaspubs.onlinelibrary.wiley.com/doi/abs/10.1111/j.1749-6632.2010.05888.x,unknown,unknown
Machine learning with brain graphs: predictive modeling approaches for functional imaging in systems neuroscience,"J Richiardi, S Achard, H Bunke…",2013,250,"… In what we believe to be the earliest use of machine learning on brain graphs in clinical neuroscience, an atlas was used to extract 22 brain regions, from which a brain graph was …",l9ppJhB6DWkJ,"J Richiardi, S Achard, H Bunke… - IEEE Signal processing …, 2013 - miplab.epfl.ch",[],https://miplab.epfl.ch/pub/richiardi1301.pdf,unknown,unknown
Comparative connectomics,"MP Van den Heuvel, ET Bullmore, O Sporns",2016,432,"… derived connectome reconstructions can provide information about the strength of connections (often referred to in graph theoretical analysis as ‘weighted networks’), connectome maps …",UHcvBZAwgMMJ,"MP Van den Heuvel, ET Bullmore, O Sporns - Trends in cognitive sciences, 2016 - cell.com",[],https://www.cell.com/trends/cognitive-sciences/abstract/S1364-6613(16)00048-6,unknown,unknown
Identifying the neural network for neuromodulation in epilepsy through connectomics and graphs,"A Vetkas, J Germann, G Elias, A Loh…",2022,34,"… We hypothesized that ANT, CMT and HC targets would exhibit connectomic overlap and that their functional networks would overlap with known epileptic circuits and with the DMN. …",PlwHstfnA7IJ,"A Vetkas, J Germann, G Elias, A Loh… - Brain …, 2022 - academic.oup.com",[],https://academic.oup.com/braincomms/article-abstract/4/3/fcac092/6564142,unknown,unknown
Multimodal brain connectomics-based prediction of Parkinson's disease using graph attention networks,"A Safai, N Vakharia, S Prasad, J Saini…",2022,35,"… employ and interpret multimodal connectomic data have not … motor network as well as variable changes in multiple brain … for graph classification, using multimodal brain connectomics …",D_lYnqT0DbwJ,"A Safai, N Vakharia, S Prasad, J Saini… - … in Neuroscience, 2022 - frontiersin.org",[],https://www.frontiersin.org/journals/neuroscience/articles/10.3389/fnins.2021.741489/full,unknown,unknown
Fundamentals of brain network analysis,"A Fornito, A Zalesky, E Bullmore",2016,1488,… This focus on network neuroscience will be especially … graph theory has been applied to understand brain networks and how it has emerged as a powerful analytic tool for connectomics…,dlqLh6H9l8gJ,"A Fornito, A Zalesky, E Bullmore - 2016 - books.google.com",[],https://books.google.com/books?hl=en&lr=&id=Hc-cBAAAQBAJ&oi=fnd&pg=PP1&dq=network+neuroscience+connectomics+brain+graphs&ots=AOECxm0X6c&sig=MI-t4BYufOQI9LBKkxPUHD3_B8o,unknown,unknown
Graph Theoretical Analysis of the Brain. An Overview.,"P Finotelli, P Dulio",2015,10,"… connectivity, we should introduce besides the connectome, other important concepts such as the parcellation and neural connectivity. The parcellation is the subdivision of the …",wBmQ4tWUU7gJ,"P Finotelli, P Dulio - Scienze e Ricerche, 2015 - re.public.polimi.it",[],https://re.public.polimi.it/bitstream/11311/980102/4/Graph%20Theoretical%20Analysis%20of%20the%20Brain.%20An%20Overview_11311-980102_Dulio.pdf,unknown,unknown
The structural connectome in traumatic brain injury: A meta-analysis of graph metrics,"P Imms, A Clemente, M Cook, W D'Souza…",2019,96,"… Our findings suggest that the TBI structural network has shifted away from the balanced small-world network towards a regular lattice. Therefore, these graph metrics may be useful …",vTatUdCfyMUJ,"P Imms, A Clemente, M Cook, W D'Souza… - Neuroscience & …, 2019 - Elsevier",[],https://www.sciencedirect.com/science/article/pii/S0149763418306730,unknown,unknown
Relating network connectivity to dynamics: opportunities and challenges for theoretical neuroscience,"C Curto, K Morrison",2019,54,"… stemming from network science provide a valuable starting point, the interpretation of graph-… network. Properties that are quite meaningful for linear dynamics, such as random walk and …",ca_ZU9YsbrQJ,"C Curto, K Morrison - Current opinion in neurobiology, 2019 - Elsevier",[],https://www.sciencedirect.com/science/article/pii/S0959438819300443,unknown,unknown
Combining network topology and information theory to construct representative brain networks,"AI Luppi, EA Stamatakis",2021,121,"… Network neuroscience employs graph theory to investigate the human brain as a complex network… Based on functional and diffusion MRI data from the Human Connectome Project, we …",yeIbkTOHj2IJ,"AI Luppi, EA Stamatakis - Network Neuroscience, 2021 - direct.mit.edu",[],https://direct.mit.edu/netn/article-abstract/5/1/96/97529,unknown,unknown
Application of graph theory to assess static and dynamic brain connectivity: Approaches for building brain graphs,"Q Yu, Y Du, J Chen, J Sui, T Adalē…",2018,103,"… brain nodes, building dynamic and multimodal brain graphs, and point out potential directions for developing new tools to build and characterize brain graphs… functional brain graphs. In …",elaEEmwCOYAJ,"Q Yu, Y Du, J Chen, J Sui, T Adalē… - Proceedings of the …, 2018 - ieeexplore.ieee.org",[],https://ieeexplore.ieee.org/abstract/document/8347205/,unknown,unknown
Graph theory measures and their application to neurosurgical eloquence,"O Tanglay, NB Dadario, EHN Chong, SJ Tang…",2023,26,"… Broadly, graphs may model structural or functional connectivity based on a group of brain regions, known as a brain network. Graph theory has been popular in connectomics, which is …",iMxb2AOd53oJ,"O Tanglay, NB Dadario, EHN Chong, SJ Tang… - Cancers, 2023 - mdpi.com",[],https://www.mdpi.com/2072-6694/15/2/556,unknown,unknown
Rethinking functional brain connectome analysis: do graph deep learning models Help,"K Han, Y Su, L He, L Zhan, S Plis, V Calhoun…",2026,5,"… in graph deep learning models on brain connectome analysis, we adjust graph density by … -based Predictive Modeling (CPM) 19 , a widely recognized model in network neuroscience …",unxZwX_QEXAJ,"K Han, Y Su, L He, L Zhan, S Plis, V Calhoun… - npj Artificial …, 2026 - nature.com",[],https://www.nature.com/articles/s44387-025-00067-x,unknown,unknown
Edges in brain networks: Contributions to models of structure and function,"J Faskowitz, RF Betzel, O Sporns",2022,161,… (B) Line graphs are representations of a network that capture how edges are connected to … This connectome predictive modeling approach involves filtering edges based on statistical …,oLycFv6L-a4J,"J Faskowitz, RF Betzel, O Sporns - Network Neuroscience, 2022 - direct.mit.edu",[],https://direct.mit.edu/netn/article-abstract/6/1/1/106931,unknown,unknown
Braingb: a benchmark for brain network analysis with graph neural networks,"H Cui, W Dai, Y Zhu, X Kan, AAC Gu…",2022,338,"… for the sophisticated connectome structures of brain networks [9]. … Rekik, “Graph neural networks in network neuroscience,” … graph neural networks for connectome-based brain disorder …",dmvJKHtzmCIJ,"H Cui, W Dai, Y Zhu, X Kan, AAC Gu… - IEEE transactions on …, 2022 - ieeexplore.ieee.org",[],https://ieeexplore.ieee.org/abstract/document/9933896/,unknown,unknown
Clinical connectomics: Mapping structural brain networks in disease,"A Zalesky, MA Di Biase",2026,2,"… for connectome mapping and analysis in neurology, … Graph-theoretic studies in clinical connectomics aim to utilize a … brain development alter the network organizational structure of the …",QnE58b30JWUJ,"A Zalesky, MA Di Biase - Neuron, 2026 - cell.com",[],https://www.cell.com/neuron/fulltext/S0896-6273(26)00090-5,unknown,unknown
Meta-connectomics: human brain network and connectivity meta-analyses,"NA Crossley, PT Fox, ET Bullmore",2016,58,"… organization of whole-brain networks. We argue that meta-connectomics is an exciting field, … Complex brain networks: graph theoretical analysis of structural and functional systems. …",KiZl6EfAkzgJ,"NA Crossley, PT Fox, ET Bullmore - Psychological medicine, 2016 - cambridge.org",[],https://www.cambridge.org/core/journals/psychological-medicine/article/metaconnectomics-human-brain-network-and-connectivity-metaanalyses/EF85DAEBA8783BF9157F41BE0B44A964,unknown,unknown
Network statistics of the whole-brain connectome of Drosophila,"A Lin, R Yang, S Dorkenwald, A Matsliah, AR Sterling…",2024,166,… Here we analyse the v630 snapshot of the Drosophila connectome as a directed weighted graph (information on the differences between v630 and v783 is provided in the Methods). …,8EWNQ32jmyUJ,"A Lin, R Yang, S Dorkenwald, A Matsliah, AR Sterling… - Nature, 2024 - nature.com",[],https://www.nature.com/articles/s41586-024-07968-y,unknown,unknown
The economy of brain network organization,"E Bullmore, O Sporns",2012,4214,"… Connectome maps, or brain graphs 66 , are beginning to reveal topological principles of brain network … This worm brain graph was found to be neither random nor regular in pattern, …",hiGDNdh6BYEJ,"E Bullmore, O Sporns - Nature reviews neuroscience, 2012 - nature.com",[],https://www.nature.com/articles/nrn3214,unknown,unknown
The topology of large open connectome networks for the human brain,"MT Gastner, G Ódor",2016,56,… connectome (ie the network of fiber connections in the brain) … brain network made available by the Open Connectome … the degree distributions of graphs containing up to nodes and …,vkFQ83VHu6YJ,"MT Gastner, G Ódor - Scientific reports, 2016 - nature.com",[],https://www.nature.com/articles/srep27249,unknown,unknown
From regions to connections and networks: new bridges between brain and behavior,"B Mišić, O Sporns",2016,317,"… Analytic advances have allowed for brain connectivity to be represented and quantified at … communities and networks. This review traces the trajectory of network neuroscience, focusing …",U7wy5o6YprgJ,"B Mišić, O Sporns - Current opinion in neurobiology, 2016 - Elsevier",[],https://www.sciencedirect.com/science/article/pii/S095943881630054X,unknown,unknown
Eigenvector PageRank difference as a measure to reveal topological characteristics of the brain connectome for neurosurgery,"O Tanglay, IM Young, NB Dadario, HM Taylor…",2022,20,"… More recently, the field of network neuroscience has emerged as a transdisciplinary … brain graph comprises the adjacency matrix of the connectome, a model of the topology of the brain. …",zAOJSyiPf4YJ,"O Tanglay, IM Young, NB Dadario, HM Taylor… - Journal of Neuro …, 2022 - Springer",[],https://link.springer.com/article/10.1007/s11060-021-03935-z,unknown,unknown
Quantifying uncertainty in brain network measures using Bayesian connectomics,"RJ Janssen, M Hinne, T Heskes…",2014,13,… a more nuanced view of the graph-theoretical properties of human brain connectivity. We refer to this model-based approach to connectivity analysis as Bayesian connectomics. …,oHiSbKgE1iUJ,"RJ Janssen, M Hinne, T Heskes… - … Neuroscience, 2014 - frontiersin.org",[],https://www.frontiersin.org/journals/computational-neuroscience/articles/10.3389/fncom.2014.00126/full,unknown,unknown
Exploring patterns of alteration in Alzheimer's disease brain networks: a combined structural and functional connectomics analysis,"F Palesi, G Castellazzi, L Casiraghi…",2016,58,"… In the present study, for each investigated RSN, analysis of structural networks showed that graph metrics decreased in patients when FA and volumes were used as weights, while the …",sdDe3MVJzeEJ,"F Palesi, G Castellazzi, L Casiraghi… - … in neuroscience, 2016 - frontiersin.org",[],https://www.frontiersin.org/journals/neuroscience/articles/10.3389/fnins.2016.00380/full,unknown,unknown
A connectome computation system for discovery science of brain,"T Xu, Z Yang, L Jiang, XX Xing, XN Zuo",2015,209,"… large neuroscience datasets. Here, we introduce a computational pipeline—namely the Connectome Computation System (CCS)—for discovery science of human brain connectomes …",sh3QJeJpCWkJ,"T Xu, Z Yang, L Jiang, XX Xing, XN Zuo - Science Bulletin, 2015 - Elsevier",[],https://www.sciencedirect.com/science/article/pii/S2095927316305394,unknown,unknown
