title,authors,year,citations,abstract,result_id,publication_info,pdf_links,url,total_results,search_time
Exploring the brain network: a review on resting-state fMRI functional connectivity,"MP Van Den Heuvel, HEH Pol",2010,4479,"… functional connectivity patterns using graph theory, focusing on the overall organization of the functional brain network. … of these new functional connectivity tools in examining believed …",ncT2ouE-LpMJ,"MP Van Den Heuvel, HEH Pol - European neuropsychopharmacology, 2010 - Elsevier",[],https://www.sciencedirect.com/science/article/pii/S0924977X10000684,unknown,unknown
Graph-based network analysis of resting-state functional MRI,"J Wang, X Zuo, Y He",2010,831,"… DTI-based structural connectivity and R-fMRI based functional connectivity, and largely … of resting-state functional connectivity correlated positively with structural connectivity strength (…",WWa-JKg6T4QJ,"J Wang, X Zuo, Y He - Frontiers in systems neuroscience, 2010 - frontiersin.org",[],https://www.frontiersin.org/journals/systems-neuroscience/articles/10.3389/fnsys.2010.00016/full,unknown,unknown
Spatio-temporal graph convolution for resting-state fMRI analysis,"S Gadgil, Q Zhao, A Pfefferbaum, EV Sullivan…",2020,311,"… to formulate functional connectivity networks within the context of spatio-temporal graphs. … on functional connectivity graphs, ie, spatio-temporal Graph Convolution (ST-GC) [24, 25]. …",R1k58emxhV0J,"S Gadgil, Q Zhao, A Pfefferbaum, EV Sullivan… - … conference on medical …, 2020 - Springer",[],https://link.springer.com/chapter/10.1007/978-3-030-59728-3_52,unknown,unknown
Loss of 'small-world'networks in Alzheimer's disease: graph analysis of FMRI resting-state functional connectivity,"EJ Sanz-Arigita, MM Schoonheim, JS Damoiseaux…",2010,788,… This study demonstrates a graph analysis of resting-state fMRI BOLD time-series of … a measure of functional coupling. The structure of the whole-brain average functional network in the …,i24SwTM3U08J,"EJ Sanz-Arigita, MM Schoonheim, JS Damoiseaux… - PloS one, 2010 - journals.plos.org",[],https://journals.plos.org/plosone/article?id=10.1371/journal.pone.0013788,unknown,unknown
Graph theoretic analysis of resting state functional MR imaging,JD Medaglia,2017,105,"… represent and study networks is graph theory, which provides … can apply graph theoretic analysis to anatomic or functional … effort to understand functional brain networks is functional MR …",EZNEUB-Cz-YJ,"JD Medaglia - Neuroimaging Clinics of North America, 2017 - Elsevier",[],https://www.sciencedirect.com/science/article/pii/S1052514917300667,unknown,unknown
Large-scale DCMs for resting-state fMRI,"A Razi, ML Seghier, Y Zhou, P McColgan…",2017,222,… We show that spectral DCM—with functional connectivity priors—is ideally suited for directed graph theoretic analyses of resting-state fMRI. We envision that directed graphs will prove …,-X3RDu-rcLsJ,"A Razi, ML Seghier, Y Zhou, P McColgan… - Network …, 2017 - direct.mit.edu",[],https://direct.mit.edu/netn/article-abstract/1/3/222/2199,unknown,unknown
… of the default mode functional connectivity in normal ageing and Alzheimer's disease using resting state fMRI with a combined approach of entropy-based and graph …,"PJ Toussaint, S Maiz, D Coynel, J Doyon, A Messé…",2014,133,… of resting state functional magnetic resonance imaging (fMRI). Here we investigate functional connectivity within the default mode network (… and AD using resting state fMRI. Images from …,hRO7IKm71HsJ,"PJ Toussaint, S Maiz, D Coynel, J Doyon, A Messé… - Neuroimage, 2014 - Elsevier",[],https://www.sciencedirect.com/science/article/pii/S1053811914006533,unknown,unknown
Test–retest reliability of resting-state connectivity network characteristics using fMRI and graph theoretical measures,"U Braun, MM Plichta, C Esslinger, C Sauer, L Haddad…",2012,521,"… graph metrics of functional networks derived from functional magnetic resonance imaging (fMRI) recorded in 33 healthy subjects during rest… from the field of graph theory, focusing on the …",k6YGc4SJpGoJ,"U Braun, MM Plichta, C Esslinger, C Sauer, L Haddad… - Neuroimage, 2012 - Elsevier",[],https://www.sciencedirect.com/science/article/pii/S105381191100961X,unknown,unknown
Resting state fMRI: A review on methods in resting state connectivity analysis and resting state networks,"KA Smitha, K Akhil Raja, KM Arun…",2017,880,… direct causal connections between functionally connected regions. Eventually effective … analysis (ICA) and graph theory analysis for studying rs-fMRI connectivity. For these techniques …,SeGc47VuypUJ,"KA Smitha, K Akhil Raja, KM Arun… - The …, 2017 - journals.sagepub.com",[],https://journals.sagepub.com/doi/abs/10.1177/1971400917697342,unknown,unknown
Age-related changes in human brain functional connectivity using graph theory and machine learning techniques in resting-state fMRI data,"S Baghernezhad, MR Daliri",2024,23,"… The purpose of the present study was to investigate brain regions and graph measures that were different in resting state fMRI data in the three age groups using AAL atlas. Also, this …",08lSssEVcZgJ,"S Baghernezhad, MR Daliri - GeroScience, 2024 - Springer",[],https://link.springer.com/article/10.1007/s11357-024-01128-w,unknown,unknown
Understanding graph isomorphism network for rs-fMRI functional connectivity analysis,"BH Kim, JC Ye",2020,217,"… fMRI data using the Graph Isomorphism Network (GIN), which was recently proposed as a powerful GNN for graph … of convolutional neural network (CNN) in the graph space where the …",QuXYlG3j9vcJ,"BH Kim, JC Ye - Frontiers in neuroscience, 2020 - frontiersin.org",[],https://www.frontiersin.org/journals/neuroscience/articles/10.3389/fnins.2020.00630/full,unknown,unknown
Decreased small-world functional network connectivity and clustering across resting state networks in schizophrenia: an fMRI classification tutorial,"A Anderson, MS Cohen",2013,132,"… tutorials to perform to identify fMRI artifacts and clean data further … how functional connectivity can be measured in a graph-… ICA, establish functional connectivity and measure the graph …",unmz1DeFV44J,"A Anderson, MS Cohen - Frontiers in human neuroscience, 2013 - frontiersin.org",[],https://www.frontiersin.org/journals/human-neuroscience/articles/10.3389/fnhum.2013.00520/full,unknown,unknown
"The frequency dimension of fMRI dynamic connectivity: Network connectivity, functional hubs and integration in the resting brain","WH Thompson, P Fransson",2015,147,… fMRI resting-state signal (0.01–0.1 Hz) in a cohort of 100 subjects. We then apply and compare graph … - and between-network connectivity and presence of functional hubs shift as a …,f06uYD3UZgcJ,"WH Thompson, P Fransson - Neuroimage, 2015 - Elsevier",[],https://www.sciencedirect.com/science/article/pii/S105381191500631X,unknown,unknown
Graph theoretical analysis of functional brain networks: test-retest evaluation on short-and long-term resting-state functional MRI data,"JH Wang, XN Zuo, S Gohel, MP Milham, BB Biswal…",2011,469,"… functional connectivity matrices rather than graph metrics between scan 2 and scan 3, followed by graph … reliability of graph-based network metrics derived from resting-state fMRI data …",QCUwqrp73VYJ,"JH Wang, XN Zuo, S Gohel, MP Milham, BB Biswal… - PloS one, 2011 - journals.plos.org",[],https://journals.plos.org/plosone/article?id=10.1371/journal.pone.0021976,unknown,unknown
Changes of functional brain networks in major depressive disorder: a graph theoretical analysis of resting-state fMRI,"M Ye, T Yang, P Qing, X Lei, J Qiu, G Liu",2015,188,"… Moreover, disruptions in functional connectivity have been observed … resting-state fMRI and graph theoretical analyses to further explore the MDD-related disruptions in functional brain …",sHjW5XAu-EAJ,"M Ye, T Yang, P Qing, X Lei, J Qiu, G Liu - PloS one, 2015 - journals.plos.org",[],https://journals.plos.org/plosone/article?id=10.1371/journal.pone.0133775,unknown,unknown
A method for independent component graph analysis of resting‐state fMRI,"D Ribeiro de Paula, E Ziegler…",2017,32,… The evaluation of functional connectivity from resting-state fMRI data is broadly based on two families of analytical methods. Seed-based correlation analysis estimates the relationship …,wWIi1_Ae2VAJ,"D Ribeiro de Paula, E Ziegler… - Brain and …, 2017 - Wiley Online Library",[],https://onlinelibrary.wiley.com/doi/abs/10.1002/brb3.626,unknown,unknown
Proportional thresholding in resting-state fMRI functional connectivity networks and consequences for patient-control connectome studies: Issues and …,"MP van den Heuvel, SC de Lange, A Zalesky…",2017,573,… of functional matrices and subsequent graph analysis in patient-control functional … show that differences in overall strength of functional connectivity (FC) – as often observed …,cDsaZH2d9GIJ,"MP van den Heuvel, SC de Lange, A Zalesky… - Neuroimage, 2017 - Elsevier",[],https://www.sciencedirect.com/science/article/pii/S105381191730109X,unknown,unknown
Graph-theory based parcellation of functional subunits in the brain from resting-state fMRI data,"X Shen, X Papademetris, RT Constable",2010,211,"… the functional network of the … state-of-the-art graph-based partitioning approaches, and investigate their application to the problem of brain network segmentation using resting-state fMRI…",RKfAXQTXM6UJ,"X Shen, X Papademetris, RT Constable - Neuroimage, 2010 - Elsevier",[],https://www.sciencedirect.com/science/article/pii/S105381190901427X,unknown,unknown
Identification of voxels confounded by venous signals using resting-state fMRI functional connectivity graph community identification,"K Kalcher, RN Boubela, W Huf, C Našel…",2015,19,… functional connectivity graphs were computed on minimally preprocessed low TR (333 ms) multiband resting-state fMRI … edges in the resulting sparse graph reflect the high coherence of …,D9id3ibpMvkJ,"K Kalcher, RN Boubela, W Huf, C Našel… - Frontiers in …, 2015 - frontiersin.org",[],https://www.frontiersin.org/journals/neuroscience/articles/10.3389/fnins.2015.00472/full,unknown,unknown
An introduction to resting state fMRI functional connectivity,"J Bijsterbosch, SM Smith, C Beckmann",2017,297,"… ), which greatly improve the likelihood of resting state fMRI being used in clinical settings. … look-up graphs needed for personalized medicine (similar to the graphs that indicate the …",q_NK2zdE7FcJ,"J Bijsterbosch, SM Smith, C Beckmann - 2017 - books.google.com",[],https://books.google.com/books?hl=en&lr=&id=JDwkDwAAQBAJ&oi=fnd&pg=PP1&dq=resting+state+fMRI+functional+connectivity+graph&ots=cbD2_VuZTF&sig=Ms3xjJ5QcfHKJHQ1PWhvmdRMHCc,unknown,unknown
Current methods and new directions in resting state fMRI,"J Yang, S Gohel, B Vachha",2020,145,Resting state functional connectivity magnetic resonance imaging (rsfcMRI) has become a key component of investigations of neurocognitive and psychiatric behaviors. Over the past …,TUhBcR5m8EoJ,"J Yang, S Gohel, B Vachha - Clinical imaging, 2020 - Elsevier",[],https://www.sciencedirect.com/science/article/pii/S0899707120301029,unknown,unknown
Resting state fMRI functional connectivity-based classification using a convolutional neural network architecture,"RJ Meszlényi, K Buza, Z Vidnyánszky",2017,202,… resting state fMRI functional connectome offers a unique way to understand large scale functional … one should consider the graph structure behind the connectivity matrix to determine …,uD5-ivJ1hoMJ,"RJ Meszlényi, K Buza, Z Vidnyánszky - Frontiers in neuroinformatics, 2017 - frontiersin.org",[],https://www.frontiersin.org/journals/neuroinformatics/articles/10.3389/fninf.2017.00061/full,unknown,unknown
Change in brain network topology as a function of treatment response in schizophrenia: a longitudinal resting-state fMRI study using graph theory,"JA Hadley, NV Kraguljac, DM White, L Ver Hoef…",2016,136,… to assess functional integration and functional segregation of brain networks using graph … This pattern of aberrant functional network integration and segregation was modulated with …,RjEO8yVWOlsJ,"JA Hadley, NV Kraguljac, DM White, L Ver Hoef… - npj …, 2016 - nature.com",[],https://www.nature.com/articles/npjschz201614,unknown,unknown
Functional connectomics from resting-state fMRI,"SM Smith, D Vidaurre, CF Beckmann…",2013,1251,"… Early rfMRI studies typically characterised functional connectivity via a small number of large… , and ends with abstract graph-theoretical network analyses that require the network to have …",_7uOxs245lAJ,"SM Smith, D Vidaurre, CF Beckmann… - Trends in cognitive …, 2013 - cell.com",[],https://www.cell.com/cognitive-sciences/abstract/S1364-6613(13)00220-9,unknown,unknown
Network analysis of functional brain connectivity in borderline personality disorder using resting-state fMRI,"T Xu, KR Cullen, B Mueller, MW Schreiner, KO Lim…",2016,139,"… functional brain networks by correlating wavelet-filtered fMRI … We employed graph-theory based complex network analysis … , and employed network-based statistic to identify functional …",2Vu8SFKcHl0J,"T Xu, KR Cullen, B Mueller, MW Schreiner, KO Lim… - NeuroImage: Clinical, 2016 - Elsevier",[],https://www.sciencedirect.com/science/article/pii/S2213158216300274,unknown,unknown
"Multiband fMRI as a plausible, time-saving technique for resting-state data acquisition: study on functional connectivity mapping using graph theoretical measures","KA Smitha, KM Arun, PG Rajesh, SE Joel…",2018,21,… as the functional connectivity using conventional resting-state fMRI (rsfMRI) … resting-state fMRI (rsfMRI) and MB-rsfMRI technique. A strong positive correlation was seen between graph …,XtGUxFesPOoJ,"KA Smitha, KM Arun, PG Rajesh, SE Joel… - Magnetic Resonance …, 2018 - Elsevier",[],https://www.sciencedirect.com/science/article/pii/S0730725X18302339,unknown,unknown
Functional connectivity in resting-state fMRI: is linear correlation sufficient?,"J Hlinka, M Paluš, M Vejmelka, D Mantini, M Corbetta",2011,299,"… We apply this method to 24 sessions of human resting state fMRI. For each session, matrix of connectivities between 90 anatomical parcel time series is computed using mutual …",0lR5kOUCLzIJ,"J Hlinka, M Paluš, M Vejmelka, D Mantini, M Corbetta - NeuroImage, 2011 - Elsevier",[],https://www.sciencedirect.com/science/article/pii/S1053811910011249,unknown,unknown
Exploring resting-state functional connectivity invariants across the lifespan in healthy people by means of a recently proposed graph theoretical model,"P Finotelli, O Dipasquale, I Costantini, A Pini, F Baglio…",2018,19,"… In this paper we investigate the changes in the functional connectivity intensity, and some … span and at resting state. For the explicit computation of the functional connectivity we exploit a …",6D1KD0e5S90J,"P Finotelli, O Dipasquale, I Costantini, A Pini, F Baglio… - PLoS …, 2018 - journals.plos.org",[],https://journals.plos.org/plosone/article?id=10.1371/journal.pone.0206567,unknown,unknown
Quantitative comparison of resting-state functional connectivity derived from fNIRS and fMRI: a simultaneous recording study,"L Duan, YJ Zhang, CZ Zhu",2012,221,"… Finally, for the first time, we combined fNIRS and graph theory to investigate topological properties of resting-state brain networks. The clustering coefficient (C p ) and characteristic path …",0YfpnYwwQfwJ,"L Duan, YJ Zhang, CZ Zhu - Neuroimage, 2012 - Elsevier",[],https://www.sciencedirect.com/science/article/pii/S1053811912001917,unknown,unknown
Resting-state functional connectivity magnetic resonance imaging and outcome after acute stroke,"J Puig, G Blasco, A Alberich-Bayarri, G Schlaug…",2018,112,… to explore the functional connectivity between regions and graph-computation analysis to detect differences in functional connectivity between patients with good functional outcome (…,0jJvemxxuJEJ,"J Puig, G Blasco, A Alberich-Bayarri, G Schlaug… - Stroke, 2018 - ahajournals.org",[],https://www.ahajournals.org/doi/abs/10.1161/STROKEAHA.118.021319,unknown,unknown
Identifying patients with Alzheimer's disease using resting-state fMRI and graph theory,"A Khazaee, A Ebrahimzadeh…",2015,316,"… graph theoretical approaches with advanced machine learning methods to study functional brain network … and graph of brain network, on the basis of the resting state fMRI data, can …",TTl0AVZKT8sJ,"A Khazaee, A Ebrahimzadeh… - Clinical Neurophysiology, 2015 - Elsevier",[],https://www.sciencedirect.com/science/article/pii/S1388245715002242,unknown,unknown
Brain complex network analysis by means of resting state fMRI and graph analysis: will it be helpful in clinical epilepsy?,"H Onias, A Viol, F Palhano-Fontes, KC Andrade…",2014,85,"… the ongoing fMRI signals when individuals are at rest. These datasets have been largely analyzed in the context of functional connectivity, which inspects the covariance of fMRI signals …",Sd9FRVcWoi8J,"H Onias, A Viol, F Palhano-Fontes, KC Andrade… - Epilepsy & Behavior, 2014 - Elsevier",[],https://www.sciencedirect.com/science/article/pii/S1525505013006173,unknown,unknown
Hemodynamic response function (HRF) variability confounds resting‐state fMRI functional connectivity,"D Rangaprakash, GR Wu, D Marinazzo…",2018,153,"… Here, we present the graphs for ΔFC versus ΔRH (Figure 3A), ΔFC versus ΔTTP (Figure 3B), ΔFC versus ΔFWHM (Figure 3C), and ΔFC versus absolute neural-FC (Figure 3D). …",WXhKWSeo1K8J,"D Rangaprakash, GR Wu, D Marinazzo… - Magnetic resonance …, 2018 - Wiley Online Library",[],https://onlinelibrary.wiley.com/doi/abs/10.1002/mrm.27146,unknown,unknown
Resting-state functional connectivity in autism spectrum disorders: a review,"JV Hull, LB Dokovna, ZJ Jacokes…",2017,696,"… of the study, resting-state fMRI data were used to calculate global functional connectivity density, … A recent increase in the use of graph theory and network analysis of FC in rs-fMRI has …",GeA-4xpCWkkJ,"JV Hull, LB Dokovna, ZJ Jacokes… - Frontiers in …, 2017 - frontiersin.org",[],https://www.frontiersin.org/journals/psychiatry/articles/10.3389/fpsyt.2016.00205/full,unknown,unknown
Connectivity graph analysis of the auditory resting state network in tinnitus,"A Maudoux, P Lefebvre, JE Cabay, A Demertzi…",2012,214,… Our results show a modified functional connectivity pattern in tinnitus sufferers and highlight the role of the parahippocampal region in tinnitus physiopathology. They also point out the …,IwTKd2LstO0J,"A Maudoux, P Lefebvre, JE Cabay, A Demertzi… - Brain research, 2012 - Elsevier",[],https://www.sciencedirect.com/science/article/pii/S0006899312008438,unknown,unknown
Decoding brain states from fMRI connectivity graphs,"J Richiardi, H Eryilmaz, S Schwartz, P Vuilleumier…",2011,400,Functional connectivity analysis of fMRI data can reveal … characteristic connectivity signatures of different brain states … Exploiting multi-band classification of connectivity graphs is also …,ud7S_frspJwJ,"J Richiardi, H Eryilmaz, S Schwartz, P Vuilleumier… - Neuroimage, 2011 - Elsevier",[],https://www.sciencedirect.com/science/article/pii/S1053811910008335,unknown,unknown
Test-retest reliability of graph metrics of resting state MRI functional brain networks: A review,"M Andellini, V Cannatà, S Gazzellini, B Bernardi…",2015,140,… explore the overall structure of local and global functional connectivity in the brain. Due to its … in network reliability which apply graph theory to analyze connectome resting state networks…,_9A_TwK2m8cJ,"M Andellini, V Cannatà, S Gazzellini, B Bernardi… - Journal of neuroscience …, 2015 - Elsevier",[],https://www.sciencedirect.com/science/article/pii/S0165027015002113,unknown,unknown
Graph theory analysis of functional connectivity in major depression disorder with high-density resting state EEG data,"S Sun, X Li, J Zhu, Y Wang, R La…",2019,194,"… used to obtain the functional connectivity matrices from fMRI, MEG and … functional connectivity of MDD at resting state based on sensor layer EEG signals. But the functional connectivity …",PYcxhcJBPXgJ,"S Sun, X Li, J Zhu, Y Wang, R La… - … on Neural Systems …, 2019 - ieeexplore.ieee.org",[],https://ieeexplore.ieee.org/abstract/document/8624575/,unknown,unknown
The influence of preprocessing steps on graph theory measures derived from resting state fMRI,"F Gargouri, F Kallel, S Delphine…",2018,58,"… of the preprocessing steps impacted the graph theory measures. Overall, our results confirmed that graph theory measures of functional connectivity depend on the ordering of the …",3wsVcorqaOMJ,"F Gargouri, F Kallel, S Delphine… - Frontiers in …, 2018 - frontiersin.org",[],https://www.frontiersin.org/journals/computational-neuroscience/articles/10.3389/fncom.2018.00008/full,unknown,unknown
Identifying sparse connectivity patterns in the brain using resting-state fMRI,"H Eavani, TD Satterthwaite, R Filipovych, RE Gur…",2015,124,… Our results from simulated as well as real resting state fMRI data show that SCPs are … of intrinsic functional connectivity and provide novel insights into the functional organization …,AMv8Fevcfa4J,"H Eavani, TD Satterthwaite, R Filipovych, RE Gur… - Neuroimage, 2015 - Elsevier",[],https://www.sciencedirect.com/science/article/pii/S1053811914008003,unknown,unknown
Resting-state fMRI: a review of methods and clinical applications,"MH Lee, CD Smyser, JS Shimony",2013,1643,"… at rest, termed resting-state fMRI or functional connectivity MR imaging. RS-fMRI investigates … . Undirected graphs of frequency-dependent functional connectivity in whole brain networks…",AiIHJdPlVHwJ,"MH Lee, CD Smyser, JS Shimony - American Journal of neuroradiology, 2013 - ajnr.org",[],https://www.ajnr.org/content/34/10/1866.short,unknown,unknown
Resting state fMRI functional connectivity analysis using dynamic time warping,"RJ Meszlényi, P Hermann, K Buza, V Gál…",2017,120,… We tested our method using resting-state fMRI data from repeated … resting-state functional connectivity using DTW provides an efficient new way for characterizing functional …,x6AKa_w1e-gJ,"RJ Meszlényi, P Hermann, K Buza, V Gál… - Frontiers in …, 2017 - frontiersin.org",[],https://www.frontiersin.org/journals/neuroscience/articles/10.3389/fnins.2017.00075/full,unknown,unknown
Functional connectivity changes in multiple sclerosis patients: a graph analytical study of MEG resting state data,"MM Schoonheim, JJG Geurts, D Landi…",2013,143,"… by graph analytical … functional changes and clinical/cognitive functioning in MS is as of yet unclear. In this study, we used resting-state MEG to study changes in functional connectivity in …",jKUUCqQHGcQJ,"MM Schoonheim, JJG Geurts, D Landi… - Human brain …, 2013 - Wiley Online Library",[],https://onlinelibrary.wiley.com/doi/abs/10.1002/hbm.21424,unknown,unknown
Language in the brain at rest: new insights from resting state data and graph theoretical analysis,"AM Muller, M Meyer",2014,100,"… the meaning of anticorrelated nodes in a specific functional network, we decided to perform all further modularity and all graph analyses on the network of these 16 nodes, which had …",-V5bgT49lEAJ,"AM Muller, M Meyer - Frontiers in human neuroscience, 2014 - frontiersin.org",[],https://www.frontiersin.org/journals/human-neuroscience/articles/10.3389/fnhum.2014.00228/full,unknown,unknown
Modeling the outcome of structural disconnection on resting-state functional connectivity,"J Cabral, E Hugues, ML Kringelbach, G Deco",2012,212,"… healthy resting-state functional connectivity with graph properties … connectivity is decreased, either globally or locally, the resultant simulated functional connectivity exhibited a network …",FxklZ2FlSFkJ,"J Cabral, E Hugues, ML Kringelbach, G Deco - Neuroimage, 2012 - Elsevier",[],https://www.sciencedirect.com/science/article/pii/S1053811912005848,unknown,unknown
Brain connections-resting state fMRI functional connectivity,"M De La Iglesia-vaya, J Molina-Mateo…",2013,27,… Applying graph theory to resting state fMRI data involves assigning nodes to various regions of interest. A functional connectivity graph is generated once edges are assigned to connect …,9g9mekPa0sIJ,"M De La Iglesia-vaya, J Molina-Mateo… - Novel frontiers of …, 2013 - books.google.com",[],https://books.google.com/books?hl=en&lr=&id=-92dDwAAQBAJ&oi=fnd&pg=PA51&dq=resting+state+fMRI+functional+connectivity+graph&ots=TviaD0Hyr0&sig=_GQRUIi9lmqcgVYANgdBZl0MVeI,unknown,unknown
Quantifying temporal correlations: A test–retest evaluation of functional connectivity in resting-state fMRI,"M Fiecas, H Ombao, D Van Lunen, R Baumgartner…",2013,103,… –retest resting-state fMRI data set to perform a systematic investigation of the stability of the metrics that are often used in resting-state functional connectivity (FC) studies. The fMRI data …,N-8BYA7V4sEJ,"M Fiecas, H Ombao, D Van Lunen, R Baumgartner… - NeuroImage, 2013 - Elsevier",[],https://www.sciencedirect.com/science/article/pii/S1053811912009627,unknown,unknown
Classification of patients with MCI and AD from healthy controls using directed graph measures of resting-state fMRI,"A Khazaee, A Ebrahimzadeh, A Babajani-Feremi…",2017,211,"… resting-state functional magnetic resonance imaging (rs-fMRI) data of 34 AD, 89 MCI, and 45 HC to calculate various directed graph … the potential of directed graph measures of rs-fMRI …",c3icUtdXn00J,"A Khazaee, A Ebrahimzadeh, A Babajani-Feremi… - Behavioural brain …, 2017 - Elsevier",[],https://www.sciencedirect.com/science/article/pii/S0166432816304077,unknown,unknown
